{
  "$schema": "../skills/c99-standard-c/huawei-c-rule-catalog.schema.json",
  "schema": "huawei-c-rule-catalog",
  "version": "1.0.0",
  "source": {
    "title": "华为 C 语言编程规范 DKBA 2826-2011.5",
    "pdf": "references/huawei-c-language-programming-standard-dkba-2826-2011-5.pdf",
    "markdown": "references/huawei-c-language-programming-standard-dkba-2826-2011-5.md",
    "sha256": "80D23AC9CACB83AEBAA1C28889271F744D5866CA45D09266533895F256262200",
    "pages": 61,
    "chapters": {
      "first": 0,
      "last": 16,
      "clauseChapters": [
        1,
        15
      ]
    }
  },
  "summary": {
    "expectedClauses": 139,
    "actualClauses": 139,
    "kindCounts": {
      "原则": 21,
      "建议": 50,
      "规则": 68
    },
    "primaryVerificationCounts": {
      "compile": 28,
      "demo": 32,
      "lint": 33,
      "manual": 14,
      "test": 32
    },
    "unclassifiedClauses": 0
  },
  "nonClauseSections": [
    {
      "section": "封面、修订声明、目录、范围和简介",
      "primaryVerification": "manual",
      "evidence": [
        "references/huawei-c-language-programming-standard-dkba-2826-2011-5.md:文档元数据与目录",
        "tools/pdf-reference/verify_reference.py:页数、章节与噪声检查"
      ],
      "status": "covered"
    },
    {
      "section": "0 规范制订说明",
      "primaryVerification": "manual",
      "evidence": [
        "AGENTS.md:适用范围与权威来源",
        "AGENTS.md:修改工作流",
        "docs/spec/SELECTED_SOLUTION.md:规则优先级与证据策略"
      ],
      "status": "covered"
    },
    {
      "section": "16 业界编程规范",
      "primaryVerification": "manual",
      "evidence": [
        "references/huawei-c-language-programming-standard-dkba-2826-2011-5.md:第16章",
        "AGENTS.md:编译、测试与安全输入",
        "scripts/verify.ps1:严格工具链门禁"
      ],
      "status": "covered"
    }
  ],
  "clauses": [
    {
      "id": "HW-C99-01-P-01",
      "chapter": 1,
      "chapterTitle": "头文件",
      "kind": "原则",
      "number": "1.1",
      "title": "头文件中适合放置接口的声明，不适合放置实现。",
      "sourceLine": 199,
      "primaryVerification": "compile",
      "verificationMethods": [
        "compile",
        "lint",
        "demo"
      ],
      "evidence": [
        "generated-demo/demo.h",
        "generated-demo/advanced/*.h",
        "scripts/verify.ps1:header-gates",
        "lint:file.*"
      ],
      "rationale": "头文件结构由独立 C/C++ 编译、文件 lint 和同名实现共同证明。",
      "status": "covered"
    },
    {
      "id": "HW-C99-01-P-02",
      "chapter": 1,
      "chapterTitle": "头文件",
      "kind": "原则",
      "number": "1.2",
      "title": "头文件应当职责单一。",
      "sourceLine": 213,
      "primaryVerification": "compile",
      "verificationMethods": [
        "compile",
        "lint",
        "demo"
      ],
      "evidence": [
        "generated-demo/demo.h",
        "generated-demo/advanced/*.h",
        "scripts/verify.ps1:header-gates",
        "lint:file.*"
      ],
      "rationale": "头文件结构由独立 C/C++ 编译、文件 lint 和同名实现共同证明。",
      "status": "covered"
    },
    {
      "id": "HW-C99-01-P-03",
      "chapter": 1,
      "chapterTitle": "头文件",
      "kind": "原则",
      "number": "1.3",
      "title": "头文件应向稳定的方向包含。",
      "sourceLine": 252,
      "primaryVerification": "compile",
      "verificationMethods": [
        "compile",
        "lint",
        "demo"
      ],
      "evidence": [
        "generated-demo/demo.h",
        "generated-demo/advanced/*.h",
        "scripts/verify.ps1:header-gates",
        "lint:file.*"
      ],
      "rationale": "头文件结构由独立 C/C++ 编译、文件 lint 和同名实现共同证明。",
      "status": "covered"
    },
    {
      "id": "HW-C99-01-R-01",
      "chapter": 1,
      "chapterTitle": "头文件",
      "kind": "规则",
      "number": "1.1",
      "title": "每一个.c文件应有一个同名.h文件，用于声明需要对外公开的接口。",
      "sourceLine": 262,
      "primaryVerification": "compile",
      "verificationMethods": [
        "compile",
        "lint",
        "demo"
      ],
      "evidence": [
        "generated-demo/demo.c+h",
        "generated-demo/advanced/state_machine.c+h",
        "generated-demo/advanced/protocol.c+h",
        "generated-demo/advanced/fixed_pool.c+h"
      ],
      "rationale": "头文件结构由独立 C/C++ 编译、文件 lint 和同名实现共同证明。",
      "status": "covered"
    },
    {
      "id": "HW-C99-01-R-02",
      "chapter": 1,
      "chapterTitle": "头文件",
      "kind": "规则",
      "number": "1.2",
      "title": "禁止头文件循环依赖。",
      "sourceLine": 312,
      "primaryVerification": "compile",
      "verificationMethods": [
        "compile",
        "lint",
        "demo"
      ],
      "evidence": [
        "generated-demo/demo.h",
        "generated-demo/advanced/*.h",
        "scripts/verify.ps1:header-gates",
        "lint:file.*"
      ],
      "rationale": "头文件结构由独立 C/C++ 编译、文件 lint 和同名实现共同证明。",
      "status": "covered"
    },
    {
      "id": "HW-C99-01-R-03",
      "chapter": 1,
      "chapterTitle": "头文件",
      "kind": "规则",
      "number": "1.3",
      "title": ".c/.h文件禁止包含用不到的头文件。",
      "sourceLine": 316,
      "primaryVerification": "compile",
      "verificationMethods": [
        "compile",
        "lint",
        "demo"
      ],
      "evidence": [
        "generated-demo/demo.h",
        "generated-demo/advanced/*.h",
        "scripts/verify.ps1:header-gates",
        "lint:file.*"
      ],
      "rationale": "头文件结构由独立 C/C++ 编译、文件 lint 和同名实现共同证明。",
      "status": "covered"
    },
    {
      "id": "HW-C99-01-R-04",
      "chapter": 1,
      "chapterTitle": "头文件",
      "kind": "规则",
      "number": "1.4",
      "title": "头文件应当自包含。",
      "sourceLine": 320,
      "primaryVerification": "compile",
      "verificationMethods": [
        "compile",
        "lint",
        "demo"
      ],
      "evidence": [
        "scripts/verify.ps1:每个头文件独立 C99/C++17 编译"
      ],
      "rationale": "头文件结构由独立 C/C++ 编译、文件 lint 和同名实现共同证明。",
      "status": "covered"
    },
    {
      "id": "HW-C99-01-R-05",
      "chapter": 1,
      "chapterTitle": "头文件",
      "kind": "规则",
      "number": "1.5",
      "title": "总是编写内部#include保护符（#define 保护）。",
      "sourceLine": 332,
      "primaryVerification": "compile",
      "verificationMethods": [
        "compile",
        "lint",
        "demo"
      ],
      "evidence": [
        "lint:file.include-guard",
        "generated-demo/demo.h:#ifndef DEMO_H"
      ],
      "rationale": "头文件结构由独立 C/C++ 编译、文件 lint 和同名实现共同证明。",
      "status": "covered"
    },
    {
      "id": "HW-C99-01-R-06",
      "chapter": 1,
      "chapterTitle": "头文件",
      "kind": "规则",
      "number": "1.6",
      "title": "禁止在头文件中定义变量。",
      "sourceLine": 374,
      "primaryVerification": "compile",
      "verificationMethods": [
        "compile",
        "lint",
        "demo"
      ],
      "evidence": [
        "generated-demo/demo.h",
        "generated-demo/advanced/*.h",
        "scripts/verify.ps1:header-gates",
        "lint:file.*"
      ],
      "rationale": "头文件结构由独立 C/C++ 编译、文件 lint 和同名实现共同证明。",
      "status": "covered"
    },
    {
      "id": "HW-C99-01-R-07",
      "chapter": 1,
      "chapterTitle": "头文件",
      "kind": "规则",
      "number": "1.7",
      "title": "只能通过包含头文件的方式使用其他.c提供的接口，禁止在.c中通过extern的方式使用外部函数接口、变量。",
      "sourceLine": 378,
      "primaryVerification": "compile",
      "verificationMethods": [
        "compile",
        "lint",
        "demo"
      ],
      "evidence": [
        "generated-demo/demo.h",
        "generated-demo/advanced/*.h",
        "scripts/verify.ps1:header-gates",
        "lint:file.*"
      ],
      "rationale": "头文件结构由独立 C/C++ 编译、文件 lint 和同名实现共同证明。",
      "status": "covered"
    },
    {
      "id": "HW-C99-01-R-08",
      "chapter": 1,
      "chapterTitle": "头文件",
      "kind": "规则",
      "number": "1.8",
      "title": "禁止在extern \"C\"中包含头文件。",
      "sourceLine": 382,
      "primaryVerification": "compile",
      "verificationMethods": [
        "compile",
        "lint",
        "demo"
      ],
      "evidence": [
        "generated-demo/demo.h",
        "generated-demo/advanced/*.h",
        "scripts/verify.ps1:header-gates",
        "lint:file.*"
      ],
      "rationale": "头文件结构由独立 C/C++ 编译、文件 lint 和同名实现共同证明。",
      "status": "covered"
    },
    {
      "id": "HW-C99-01-S-01",
      "chapter": 1,
      "chapterTitle": "头文件",
      "kind": "建议",
      "number": "1.1",
      "title": "一个模块通常包含多个.c文件，建议放在同一个目录下，目录名即为模块名。为方便外部使用者，建议每一个模块提供一个.h，文件名为目录名。",
      "sourceLine": 446,
      "primaryVerification": "compile",
      "verificationMethods": [
        "compile",
        "lint",
        "demo"
      ],
      "evidence": [
        "generated-demo/demo.h",
        "generated-demo/advanced/*.h",
        "scripts/verify.ps1:header-gates",
        "lint:file.*"
      ],
      "rationale": "头文件结构由独立 C/C++ 编译、文件 lint 和同名实现共同证明。",
      "status": "covered"
    },
    {
      "id": "HW-C99-01-S-02",
      "chapter": 1,
      "chapterTitle": "头文件",
      "kind": "建议",
      "number": "1.2",
      "title": "如果一个模块包含多个子模块，则建议每一个子模块提供一个对外的.h，文件名为子模块名。",
      "sourceLine": 456,
      "primaryVerification": "compile",
      "verificationMethods": [
        "compile",
        "lint",
        "demo"
      ],
      "evidence": [
        "generated-demo/demo.h",
        "generated-demo/advanced/*.h",
        "scripts/verify.ps1:header-gates",
        "lint:file.*"
      ],
      "rationale": "头文件结构由独立 C/C++ 编译、文件 lint 和同名实现共同证明。",
      "status": "covered"
    },
    {
      "id": "HW-C99-01-S-03",
      "chapter": 1,
      "chapterTitle": "头文件",
      "kind": "建议",
      "number": "1.3",
      "title": "头文件不要使用非习惯用法的扩展名，如.inc。",
      "sourceLine": 460,
      "primaryVerification": "compile",
      "verificationMethods": [
        "compile",
        "lint",
        "demo"
      ],
      "evidence": [
        "generated-demo/demo.h",
        "generated-demo/advanced/*.h",
        "scripts/verify.ps1:header-gates",
        "lint:file.*"
      ],
      "rationale": "头文件结构由独立 C/C++ 编译、文件 lint 和同名实现共同证明。",
      "status": "covered"
    },
    {
      "id": "HW-C99-01-S-04",
      "chapter": 1,
      "chapterTitle": "头文件",
      "kind": "建议",